<?xml version="1.0" encoding="UTF-8"?>
<genres xmlns="corpus.search.auto" xmlns:xsi="http://www.w3.org/2001/XMLSchema-instance" xsi:schemaLocation="corpus.search.auto genres-schema.xsd" corpora="PPCME2">
  <genre name="Philosophy">
    <corpus>cmboeth.m3</corpus>
  </genre>
  <genre name="History">
    <corpus>cmbrut3.m3</corpus>
    <corpus>cmcapchr.m4</corpus>
    <corpus>cmgregor.m4</corpus>
    <corpus>cmpeterb.m1</corpus>
    <corpus>cmpolych.m3</corpus>
  </genre>
  <genre name="Travelogue">
    <corpus>cmmandev.m3</corpus>
  </genre>
  <genre name="Bible and Apocrypha">
    <corpus>cmearlps.m2</corpus>
    <corpus>cmntest.m3</corpus>
    <corpus>cmotest.m3</corpus>
  </genre>
  <genre name="Homilies and Sermons">
    <corpus>cmcapser.m4</corpus>
    <corpus>cmfitzja.m4</corpus>
    <corpus>cmgaytry.m34</corpus>
    <corpus>cminnoce.m4</corpus>
    <corpus>cmmirk.m34</corpus>
    <corpus>cmroyal.m34</corpus>
    <corpus>cmwycser.m3</corpus>
	<corpus>cmkentho.m1</corpus>
    <corpus>cmkentse.m2</corpus>
    <corpus>cmlamb1.m1</corpus>
    <corpus>cmlambx1.mx1</corpus>
    <corpus>cmsawles.m1</corpus>
    <corpus>cmtrinit.mx1</corpus>
	<corpus>cmorm.m1</corpus>
  </genre>
  <genre name="Biography and Diaries">
    <corpus>cmedmund.m4</corpus>
    <corpus>cmjulia.m1</corpus>
    <corpus>cmkathe.m1</corpus>
    <corpus>cmmarga.m1</corpus>
  </genre>
  <genre name="Rules, Charters, Wills, Laws, Ecclesiastical Laws and Proceedings-trials">
    <corpus>cmaelr3.m23</corpus>
    <corpus>cmbenrul.m3</corpus>
  </genre>
  <genre name="Medicine, Handbooks, Religious and Educational Treatises">
    <corpus>cmaelr4.m4</corpus>
    <corpus>cmancriw-1.m1</corpus>
    <corpus>cmancriw-2.m1</corpus>
    <corpus>cmayenbi.m2</corpus>
    <corpus>cmcloud.m3</corpus>
    <corpus>cmctpars.m3</corpus>
    <corpus>cmedvern.m3</corpus>
    <corpus>cmhali.m1</corpus>
    <corpus>cmhilton.m34</corpus>
    <corpus>cmjulnor.m34</corpus>
    <corpus>cmkempe.m4</corpus>
    <corpus>cmpurvey.m3</corpus>
    <corpus>cmrollep.m24</corpus>
    <corpus>cmrolltr.m24</corpus>
    <corpus>cmvices1.m1</corpus>
    <corpus>cmvices4.m34</corpus>
	<corpus>cmedthor.m34</corpus>
	<corpus>cmhorses.m3</corpus>
    <corpus>cmthorn.mx4</corpus>
	<corpus>cmreynes.m4</corpus>
  </genre>
  <genre name="Science, Astronomy, Geography">
    <corpus>cmastro.m3</corpus>
    <corpus>cmequato.m3</corpus>
  </genre>
  <genre name="Fiction, Romances, Drama-comedies and Verse">
    <corpus>cmmalory.m4</corpus>
    <corpus>cmsiege.m4</corpus>
	<corpus>cmreynar.m4</corpus>
    <corpus>cmctmeli.m3</corpus>
  </genre>
</genres>
