<?xml version="1.0" encoding="UTF-8"?>
<genres xmlns="corpus.search.auto" xmlns:xsi="http://www.w3.org/2001/XMLSchema-instance" xsi:schemaLocation="corpus.search.auto genres-schema.xsd" corpora="PPCMBE">
  <genre name="science_other">
    <corpus>albin-1736</corpus>
    <corpus>faraday-1859</corpus>
    <corpus>herschel-1797</corpus>
    <corpus>lyell-1830</corpus>
    <corpus>priestley-1769</corpus>
    <corpus>strutt-1890</corpus>
  </genre>
  <genre name="educ_treatise">
    <corpus>anon-1711</corpus>
    <corpus>bain-1878</corpus>
    <corpus>barclay-1743</corpus>
    <corpus>benson-1908</corpus>
    <corpus>brightland-1711</corpus>
    <corpus>chapman-1774</corpus>
    <corpus>lancaster-1806</corpus>
    <corpus>webster-1718</corpus>
    <corpus>whewell-1837</corpus>
  </genre>
  <genre name="letters_priv">
    <corpus>austen-180x</corpus>
    <corpus>carlyle-1835</corpus>
    <corpus>johnson-1775</corpus>
    <corpus>montagu-1718</corpus>
    <corpus>nightingale-188x</corpus>
    <corpus>nightingale-189x</corpus>
    <corpus>victoria-186x</corpus>
    <corpus>walpole-174x</corpus>
  </genre>
  <genre name="science_medicine">
    <corpus>bardsley-1807</corpus>
    <corpus>lind-1753</corpus>
    <corpus>poore-1876</corpus>
  </genre>
  <genre name="diary">
    <corpus>benson-190x</corpus>
    <corpus>boswell-1776</corpus>
    <corpus>haydon-1808</corpus>
    <corpus>ruskin-1835</corpus>
    <corpus>ryder-1716</corpus>
    <corpus>thring-187x</corpus>
    <corpus>wesley-174x</corpus>
  </genre>
  <genre name="philosophy">
    <corpus>boethja-1897</corpus>
    <corpus>boethri-1785</corpus>
  </genre>
  <genre name="travelogue">
    <corpus>bradley-1905</corpus>
    <corpus>cook-1776</corpus>
    <corpus>cooke-1712</corpus>
    <corpus>montefiore-1836</corpus>
    <corpus>officer-1744</corpus>
    <corpus>reade-1863</corpus>
    <corpus>turner2-1800</corpus>
  </genre>
  <genre name="drama_comedy">
    <corpus>brougham-1861</corpus>
    <corpus>collier-1835</corpus>
    <corpus>colman-1805</corpus>
    <corpus>davys-1716</corpus>
    <corpus>goldsmith-1773</corpus>
    <corpus>stevens-1745</corpus>
    <corpus>wilde-1895</corpus>
  </genre>
  <genre name="sermon">
    <corpus>burton-1762</corpus>
    <corpus>butler-1726</corpus>
    <corpus>froude-1830</corpus>
    <corpus>pusey-186x</corpus>
    <corpus>talbot-1901</corpus>
    <corpus>wollaston-1793</corpus>
  </genre>
  <genre name="history">
    <corpus>carlyle-1837</corpus>
    <corpus>gibbon-1776</corpus>
    <corpus>hind-1707</corpus>
    <corpus>kimber-1742</corpus>
    <corpus>long-1866</corpus>
    <corpus>oman-1895</corpus>
    <corpus>turner1-1799</corpus>
  </genre>
  <genre name="biography_auto">
    <corpus>cibber-1740</corpus>
    <corpus>fayrer-1900</corpus>
    <corpus>okeeffe-1826</corpus>
  </genre>
  <genre name="fiction">
    <corpus>defoe-1719</corpus>
    <corpus>dickens-1837</corpus>
    <corpus>fielding-1749</corpus>
    <corpus>godwin-1805</corpus>
    <corpus>meredith-1895</corpus>
    <corpus>reeve-1777</corpus>
    <corpus>yonge-1865</corpus>
  </genre>
  <genre name="biography_other">
    <corpus>doddridge-1747</corpus>
    <corpus>southey-1813</corpus>
    <corpus>trollope-1882</corpus>
  </genre>
  <genre name="handbook_other">
    <corpus>drummond-1718</corpus>
    <corpus>fleming-1886</corpus>
    <corpus>grafting-1780</corpus>
    <corpus>maxwell-1747</corpus>
    <corpus>skeavington-184x</corpus>
    <corpus>tindall-1814</corpus>
    <corpus>weathers-1913</corpus>
  </genre>
  <genre name="bible">
    <corpus>erv-new-1881</corpus>
    <corpus>erv-old-1885</corpus>
    <corpus>newcome-new-1796</corpus>
    <corpus>purver-new-1764</corpus>
    <corpus>purver-old-1764</corpus>
  </genre>
  <genre name="letters_non-priv">
    <corpus>george-1763</corpus>
    <corpus>gladstone-1873</corpus>
    <corpus>holmes-letters-1749</corpus>
    <corpus>wellesley-1815</corpus>
  </genre>
  <genre name="proceedings_trial">
    <corpus>holmes-trial-1749</corpus>
    <corpus>townley-1746</corpus>
    <corpus>watson-1817</corpus>
  </genre>
  <genre name="law">
    <corpus>statutes-171x</corpus>
    <corpus>statutes-1745</corpus>
    <corpus>statutes-1775</corpus>
    <corpus>statutes-1805</corpus>
    <corpus>statutes-1835</corpus>
    <corpus>statutes-1865</corpus>
    <corpus>statutes-1895</corpus>
  </genre>
</genres>
