<?xml version="1.0" encoding="UTF-8"?>
<genres xmlns="corpus.search.auto" xmlns:xsi="http://www.w3.org/2001/XMLSchema-instance" xsi:schemaLocation="corpus.search.auto genres-schema.xsd" corpora="YCOE">
  <genre name="religious treatise">
    <corpus>coadrian.o34</corpus>
    <corpus>coalcuin</corpus>
    <corpus>cocura.o2</corpus>
    <corpus>cocuraC</corpus>
    <corpus>coeluc1</corpus>
    <corpus>coeluc2</corpus>
    <corpus>coleofri.o4</corpus>
    <corpus>colsigef.o3</corpus>
    <corpus>colsigewB</corpus>
    <corpus>colsigewZ.o34</corpus>
    <corpus>colwgeat</corpus>
    <corpus>colwsigeT</corpus>
    <corpus>colwsigeXa.o34</corpus>
    <corpus>colwstan1.o3</corpus>
    <corpus>colwstan2.o3</corpus>
    <corpus>cosolilo</corpus>
    <corpus>cosolsat1.o4</corpus>
    <corpus>cosolsat2</corpus>
  </genre>
  <genre name="homilies">
    <corpus>coaelhom.o3</corpus>
    <corpus>coaugust</corpus>
    <corpus>cocathom1.o3</corpus>
    <corpus>cocathom2.o3</corpus>
    <corpus>coverhomE</corpus>
    <corpus>coverhomL</corpus>
    <corpus>cowulf.o34</corpus>
  </genre>
  <genre name="biography, lives">
    <corpus>coaelive.o3</corpus>
    <corpus>cochad.o24</corpus>
    <corpus>cochristoph</corpus>
    <corpus>coeuphr</corpus>
    <corpus>coeust</corpus>
    <corpus>cogregdC.o24</corpus>
    <corpus>cogregdH.o23</corpus>
    <corpus>cojames</corpus>
    <corpus>comargaC.o34</corpus>
    <corpus>comargaT</corpus>
    <corpus>comart1</corpus>
    <corpus>comart2</corpus>
    <corpus>comart3.o23</corpus>
    <corpus>comary</corpus>
    <corpus>coneot</corpus>
    <corpus>corood</corpus>
    <corpus>cosevensl</corpus>
    <corpus>covinceB</corpus>
  </genre>
  <genre name="travelogue">
    <corpus>coalex.o23</corpus>
  </genre>
  <genre name="fiction">
    <corpus>coapollo.o3</corpus>
  </genre>
  <genre name="history">
    <corpus>cobede.o2</corpus>
    <corpus>cochronA.o23</corpus>
    <corpus>cochronC</corpus>
    <corpus>cochronD</corpus>
    <corpus>cochronE.o34</corpus>
    <corpus>coorosiu.o2</corpus>
  </genre>
  <genre name="rule">
    <corpus>cobenrul.o3</corpus>
    <corpus>cochdrul</corpus>
  </genre>
  <genre name="homs: homilies homu: homilies ls: biography, lives">
    <corpus>coblick.o23</corpus>
    <corpus>coverhom</corpus>
  </genre>
  <genre name="philosophy">
    <corpus>coboeth.o2</corpus>
    <corpus>codicts.o34</corpus>
  </genre>
  <genre name="science">
    <corpus>cobyrhtf.o3</corpus>
  </genre>
  <genre name="ecclesiastical laws">
    <corpus>cocanedgD</corpus>
    <corpus>cocanedgX</corpus>
    <corpus>coinspolD.o34</corpus>
    <corpus>coinspolX</corpus>
  </genre>
  <genre name="charters and wills">
    <corpus>codocu1.o1</corpus>
    <corpus>codocu2.o12</corpus>
    <corpus>codocu2.o2</corpus>
    <corpus>codocu3.o23</corpus>
    <corpus>codocu3.o3</corpus>
    <corpus>codocu4.o24</corpus>
  </genre>
  <genre name="epilogue">
    <corpus>coepigen.o3</corpus>
  </genre>
  <genre name="bible">
    <corpus>coexodusP</corpus>
    <corpus>cogenesiC</corpus>
    <corpus>cootest.o3</corpus>
    <corpus>cowsgosp.o3</corpus>
  </genre>
  <genre name="handbooks, medicine">
    <corpus>coherbar</corpus>
    <corpus>colacnu.o23</corpus>
    <corpus>colaece.o2</corpus>
    <corpus>coquadru.o23</corpus>
  </genre>
  <genre name="laws">
    <corpus>colaw1cn.o3</corpus>
    <corpus>colaw2cn.o3</corpus>
    <corpus>colaw5atr.o3</corpus>
    <corpus>colaw6atr.o3</corpus>
    <corpus>colawaf.o2</corpus>
    <corpus>colawafint.o2</corpus>
    <corpus>colawger.o34</corpus>
    <corpus>colawine.ox2</corpus>
    <corpus>colawnorthu.o3</corpus>
    <corpus>colawwllad.o4</corpus>
  </genre>
  <genre name="geography">
    <corpus>comarvel.o23</corpus>
  </genre>
  <genre name="apocrypha">
    <corpus>conicodA</corpus>
    <corpus>conicodC</corpus>
    <corpus>conicodD</corpus>
    <corpus>conicodE</corpus>
    <corpus>covinsal</corpus>
  </genre>
  <genre name="preface">
    <corpus>coprefcath1.o3</corpus>
    <corpus>coprefcath2.o3</corpus>
    <corpus>coprefcura.o2</corpus>
    <corpus>coprefgen.o3</corpus>
    <corpus>copreflives.o3</corpus>
    <corpus>coprefsolilo</corpus>
  </genre>
  <genre name="science, astronomy">
    <corpus>cotempo.o3</corpus>
  </genre>
</genres>
