<?xml version="1.0" encoding="UTF-8"?>
<genres xmlns="corpus.search.auto" xmlns:xsi="http://www.w3.org/2001/XMLSchema-instance" xsi:schemaLocation="corpus.search.auto genres-schema.xsd" corpora="PPCME2">
  <genre name="rule">
    <corpus>cmaelr3.m23</corpus>
    <corpus>cmbenrul.m3</corpus>
  </genre>
  <genre name="relig_treatise">
    <corpus>cmaelr4.m4</corpus>
    <corpus>cmancriw-1.m1</corpus>
    <corpus>cmancriw-2.m1</corpus>
    <corpus>cmayenbi.m2</corpus>
    <corpus>cmcloud.m3</corpus>
    <corpus>cmctpars.m3</corpus>
    <corpus>cmedvern.m3</corpus>
    <corpus>cmhali.m1</corpus>
    <corpus>cmhilton.m34</corpus>
    <corpus>cmjulnor.m34</corpus>
    <corpus>cmkempe.m4</corpus>
    <corpus>cmpurvey.m3</corpus>
    <corpus>cmrollep.m24</corpus>
    <corpus>cmrolltr.m24</corpus>
    <corpus>cmvices1.m1</corpus>
    <corpus>cmvices4.m34</corpus>
  </genre>
  <genre name="handbook_astro">
    <corpus>cmastro.m3</corpus>
    <corpus>cmequato.m3</corpus>
  </genre>
  <genre name="philosophy">
    <corpus>cmboeth.m3</corpus>
  </genre>
  <genre name="history">
    <corpus>cmbrut3.m3</corpus>
    <corpus>cmcapchr.m4</corpus>
    <corpus>cmgregor.m4</corpus>
    <corpus>cmpeterb.m1</corpus>
    <corpus>cmpolych.m3</corpus>
  </genre>
  <genre name="sermon">
    <corpus>cmcapser.m4</corpus>
    <corpus>cmfitzja.m4</corpus>
    <corpus>cmgaytry.m34</corpus>
    <corpus>cminnoce.m4</corpus>
    <corpus>cmmirk.m34</corpus>
    <corpus>cmroyal.m34</corpus>
    <corpus>cmwycser.m3</corpus>
  </genre>
  <genre name="philosophy/fiction">
    <corpus>cmctmeli.m3</corpus>
  </genre>
  <genre name="bible">
    <corpus>cmearlps.m2</corpus>
    <corpus>cmntest.m3</corpus>
    <corpus>cmotest.m3</corpus>
  </genre>
  <genre name="biography_life_of_saint">
    <corpus>cmedmund.m4</corpus>
    <corpus>cmjulia.m1</corpus>
    <corpus>cmkathe.m1</corpus>
    <corpus>cmmarga.m1</corpus>
  </genre>
  <genre name="relig_trreatise">
    <corpus>cmedthor.m34</corpus>
  </genre>
  <genre name="handbook_medicine">
    <corpus>cmhorses.m3</corpus>
    <corpus>cmthorn.mx4</corpus>
  </genre>
  <genre name="homily">
    <corpus>cmkentho.m1</corpus>
    <corpus>cmkentse.m2</corpus>
    <corpus>cmlamb1.m1</corpus>
    <corpus>cmlambx1.mx1</corpus>
    <corpus>cmsawles.m1</corpus>
    <corpus>cmtrinit.mx1</corpus>
  </genre>
  <genre name="romance">
    <corpus>cmmalory.m4</corpus>
    <corpus>cmsiege.m4</corpus>
  </genre>
  <genre name="travelogue">
    <corpus>cmmandev.m3</corpus>
  </genre>
  <genre name="homily_poetry">
    <corpus>cmorm.m1</corpus>
  </genre>
  <genre name="fiction">
    <corpus>cmreynar.m4</corpus>
  </genre>
  <genre name="handbook_other">
    <corpus>cmreynes.m4</corpus>
  </genre>
</genres>
